{
  "schema": "qmentor.optimization-record.v3",
  "problem_id": "pulser-zigzag-5-atom",
  "objective_hash": "fa7b370995e2d6a1d4073fd62232860b077662cad7d39f071cca7d9ad1f01d83",
  "feasible_set": "all 32 assignments (unconstrained QUBO from the Pulser register); feasible probability is 1 by construction",
  "exact_optimum": {
    "bitstring": "10110",
    "energy": -12.30302249,
    "runner_up": {
      "bitstring": "10100",
      "energy": -11.885023059
    }
  },
  "classical_baseline": {
    "method": "exhaustive enumeration (32 states)",
    "best_energy": -12.30302249,
    "wall_time_s": 7.8e-05
  },
  "primary_metric": "optimum_probability (exact, at the final angles; mean over seeds)",
  "resource_cap": "two-qubit gates <= 80 (reference CX-RZ-CX decomposition)",
  "budget": {
    "shots_per_evaluation": 1000,
    "max_evaluations": 60,
    "seeds": [
      7,
      11,
      13
    ],
    "total_shots_per_seed": 60000,
    "final_sample_shots": 1000,
    "stage_rule": "p in {1,2} first; p=4 only if best stage-1 optimum probability < 0.5",
    "stage2_run": true
  },
  "conventions": {
    "cost_unitary": "phase(-cost(v), gamma) = exp(-i gamma C(x)/s), s = max |coefficient| = 7.358524254",
    "mixer_unitary": "RX(beta, q) on every qubit = exp(-i (beta/2) X) per qubit",
    "rx_convention": "RX(theta) = exp(-i theta X / 2) (classiq 1.32.0 docstring); RX(beta) and RX(2 beta) label the same family with different ranges",
    "angle_bounds": "unbounded COBYLA; gammas start linspace(0,1,p), betas linspace(1,0,p), +/-0.1 seeded jitter",
    "phase_decorator": "@qfunc (official example). @qperm accepted for the cost layer by create_model, rejected for the RX mixer; no offline synthesis benefit measurable, not adopted",
    "cvar_alpha": 0.3
  },
  "variants": [
    {
      "id": "p1-mean",
      "p": 1,
      "optimizer": "SciPy COBYLA maxiter=60 on estimate_cost(quantile=1.0), 1000 shots/evaluation",
      "shots_per_evaluation": 1000,
      "max_evaluations": 60,
      "objective_mode": "mean",
      "best_feasible_energy": -12.30302249,
      "gap_to_optimum": 0.0,
      "feasible_probability": {
        "mean": 1.0,
        "ci95": [
          1.0,
          1.0
        ]
      },
      "expected_energy": {
        "mean": -7.105783,
        "ci95": [
          -11.746921,
          -2.464645
        ]
      },
      "optimum_probability": {
        "mean": 0.061518,
        "ci95": [
          0.013028,
          0.110008
        ]
      },
      "evaluations": 88,
      "depth": 24,
      "two_qubit_gates": 20,
      "wall_time_s": 0.111,
      "per_seed": [
        {
          "seed": 7,
          "evaluations": 32,
          "optimum_probability": 0.07326617064404904,
          "expected_energy": -8.26329023158775,
          "feasible_probability": 1.0,
          "best_sampled": "10110",
          "best_sampled_energy": -12.303022490433,
          "params": [
            -0.966724,
            0.827192
          ]
        },
        {
          "seed": 11,
          "evaluations": 26,
          "optimum_probability": 0.07230215274452831,
          "expected_energy": -8.103643752538137,
          "feasible_probability": 1.0,
          "best_sampled": "10110",
          "best_sampled_energy": -12.303022490433,
          "params": [
            -0.937098,
            0.922158
          ]
        },
        {
          "seed": 13,
          "evaluations": 30,
          "optimum_probability": 0.038985308038427216,
          "expected_energy": -4.95041498111112,
          "feasible_probability": 1.0,
          "best_sampled": "10110",
          "best_sampled_energy": -12.303022490433,
          "params": [
            0.342807,
            2.187895
          ]
        }
      ]
    },
    {
      "id": "p1-cvar",
      "p": 1,
      "optimizer": "SciPy COBYLA maxiter=60 on estimate_cost(quantile=0.3), 1000 shots/evaluation",
      "shots_per_evaluation": 1000,
      "max_evaluations": 60,
      "objective_mode": "cvar",
      "best_feasible_energy": -12.30302249,
      "gap_to_optimum": 0.0,
      "feasible_probability": {
        "mean": 1.0,
        "ci95": [
          1.0,
          1.0
        ]
      },
      "expected_energy": {
        "mean": -5.454815,
        "ci95": [
          -8.839162,
          -2.070468
        ]
      },
      "optimum_probability": {
        "mean": 0.046697,
        "ci95": [
          0.0,
          0.113555
        ]
      },
      "evaluations": 82,
      "depth": 24,
      "two_qubit_gates": 20,
      "wall_time_s": 0.074,
      "per_seed": [
        {
          "seed": 7,
          "evaluations": 25,
          "optimum_probability": 0.03132293628794529,
          "expected_energy": -4.6773207707298905,
          "feasible_probability": 1.0,
          "best_sampled": "10110",
          "best_sampled_energy": -12.303022490433,
          "params": [
            0.005051,
            2.033603
          ]
        },
        {
          "seed": 11,
          "evaluations": 30,
          "optimum_probability": 0.07777406325089917,
          "expected_energy": -7.027924320629248,
          "feasible_probability": 1.0,
          "best_sampled": "10110",
          "best_sampled_energy": -12.303022490433,
          "params": [
            -2.178805,
            0.716631
          ]
        },
        {
          "seed": 13,
          "evaluations": 27,
          "optimum_probability": 0.03099404536267741,
          "expected_energy": -4.659199491851011,
          "feasible_probability": 1.0,
          "best_sampled": "10110",
          "best_sampled_energy": -12.303022490433,
          "params": [
            -0.01321,
            2.121803
          ]
        }
      ]
    },
    {
      "id": "p2-mean",
      "p": 2,
      "optimizer": "SciPy COBYLA maxiter=60 on estimate_cost(quantile=1.0), 1000 shots/evaluation",
      "shots_per_evaluation": 1000,
      "max_evaluations": 60,
      "objective_mode": "mean",
      "best_feasible_energy": -12.30302249,
      "gap_to_optimum": 0.0,
      "feasible_probability": {
        "mean": 1.0,
        "ci95": [
          1.0,
          1.0
        ]
      },
      "expected_energy": {
        "mean": -8.648169,
        "ci95": [
          -9.23424,
          -8.062097
        ]
      },
      "optimum_probability": {
        "mean": 0.084939,
        "ci95": [
          0.057836,
          0.112043
        ]
      },
      "evaluations": 126,
      "depth": 47,
      "two_qubit_gates": 40,
      "wall_time_s": 0.121,
      "per_seed": [
        {
          "seed": 7,
          "evaluations": 41,
          "optimum_probability": 0.09744420216861281,
          "expected_energy": -8.894250210051734,
          "feasible_probability": 1.0,
          "best_sampled": "10110",
          "best_sampled_energy": -12.303022490433,
          "params": [
            -0.481452,
            1.396454,
            0.930209,
            -0.474839
          ]
        },
        {
          "seed": 11,
          "evaluations": 47,
          "optimum_probability": 0.07735894983183152,
          "expected_energy": -8.423916456703799,
          "feasible_probability": 1.0,
          "best_sampled": "10110",
          "best_sampled_energy": -12.303022490433,
          "params": [
            -1.186049,
            1.032081,
            0.891388,
            -0.278102
          ]
        },
        {
          "seed": 13,
          "evaluations": 38,
          "optimum_probability": 0.08001530109669983,
          "expected_energy": -8.626339420027321,
          "feasible_probability": 1.0,
          "best_sampled": "10110",
          "best_sampled_energy": -12.303022490433,
          "params": [
            -0.549236,
            0.910651,
            2.093193,
            -1.007537
          ]
        }
      ]
    },
    {
      "id": "p2-cvar",
      "p": 2,
      "optimizer": "SciPy COBYLA maxiter=60 on estimate_cost(quantile=0.3), 1000 shots/evaluation",
      "shots_per_evaluation": 1000,
      "max_evaluations": 60,
      "objective_mode": "cvar",
      "best_feasible_energy": -12.30302249,
      "gap_to_optimum": 0.0,
      "feasible_probability": {
        "mean": 1.0,
        "ci95": [
          1.0,
          1.0
        ]
      },
      "expected_energy": {
        "mean": -8.128681,
        "ci95": [
          -8.967589,
          -7.289773
        ]
      },
      "optimum_probability": {
        "mean": 0.106293,
        "ci95": [
          0.033741,
          0.178845
        ]
      },
      "evaluations": 115,
      "depth": 47,
      "two_qubit_gates": 40,
      "wall_time_s": 0.169,
      "per_seed": [
        {
          "seed": 7,
          "evaluations": 39,
          "optimum_probability": 0.1232088446505262,
          "expected_energy": -8.103640473134112,
          "feasible_probability": 1.0,
          "best_sampled": "10110",
          "best_sampled_energy": -12.303022490433,
          "params": [
            -0.734036,
            2.110987,
            0.987415,
            -0.688266
          ]
        },
        {
          "seed": 11,
          "evaluations": 37,
          "optimum_probability": 0.12310086725501572,
          "expected_energy": -7.804192538874094,
          "feasible_probability": 1.0,
          "best_sampled": "10110",
          "best_sampled_energy": -12.303022490433,
          "params": [
            -0.74379,
            2.081497,
            0.818506,
            -0.810485
          ]
        },
        {
          "seed": 13,
          "evaluations": 39,
          "optimum_probability": 0.07256850589409165,
          "expected_energy": -8.478210384212723,
          "feasible_probability": 1.0,
          "best_sampled": "10110",
          "best_sampled_energy": -12.303022490433,
          "params": [
            -0.660803,
            1.064278,
            2.20234,
            -1.009846
          ]
        }
      ]
    },
    {
      "id": "p2-mean-4000x15",
      "p": 2,